{
  "schema_version": "v1",
  "event_type": "gate.assurance.response_action",
  "time": "2026-06-16T00:01:00Z",
  "tenant_id": "acme",
  "environment": "prod",
  "drift_decision_id": "11111111-1111-1111-1111-111111111111",
  "action": "review_ticket",
  "action_metadata": {
    "review_ticket_id": "GATE-1234",
    "assignee": "platform-eng"
  },
  "trace_id": "otel-trace-1",
  "ledger_event_id": "22222222-2222-2222-2222-222222222222"
}
